Title,Year,Rated,Released,Runtime,Genre,Director,Writer,Actors,Plot,Language,Country,Awards,Poster,Metascore,imdbRating,imdbVotes,imdbID,Type,tomatoImage,tomatoRating,tomatoReviews,tomatoFresh,tomatoRotten,tomatoConsensus,tomatoUserMeter,tomatoUserRating,tomatoUserReviews,tomatoURL,DVD,BoxOffice,Production,Website,Response,totalSeasons,ratingSite,tomatoMeter
Top Hat,1935,NOT RATED,1935-09-06,101 min,"Comedy, Musical, Romance",Mark Sandrich,"Dwight Taylor (screen play), Allan Scott (screen play), Dwight Taylor (story)","Fred Astaire, Ginger Rogers, Edward Everett Horton, Erik Rhodes","An American dancer comes to Britain and falls for a model whom he initially annoyed, but she mistakes him for his goofy producer.","English, Italian",USA,Nominated for 4 Oscars. Another 2 wins & 2 nominations.,https://m.media-amazon.com/images/M/MV5BN2Q0NjE1NTMtOTY5Zi00NWMxLTliOGYtNTg1OGU5M2RjNjVkXkEyXkFqcGdeQXVyNjUwMzI2NzU@._V1_SX300.jpg,N/A,7.8,15384,tt0027125,movie,N/A,NA,NA,NA,NA,N/A,NA,NA,NA,http://www.rottentomatoes.com/m/top_hat/,2005-08-16,N/A,Turner Home Entertainment,N/A,True,NA,Rotten Tomatoes,100%
The Blair Witch Project,1999,R,1999-07-30,81 min,"Horror, Mystery","Daniel Myrick, Eduardo Sánchez","Daniel Myrick, Eduardo Sánchez","Heather Donahue, Joshua Leonard, Michael C. Williams, Bob Griffin","Three film students vanish after traveling into a Maryland forest to film a documentary on the local Blair Witch legend, leaving only their footage behind.",English,USA,18 wins & 23 nominations.,https://m.media-amazon.com/images/M/MV5BNzQ1NDBlNDItMDAyYS00YTI2LTgwMmYtMzAwMzg4NDFlM2ZmXkEyXkFqcGdeQXVyMTQxNzMzNDI@._V1_SX300.jpg,81,6.4,213687,tt0185937,movie,N/A,NA,NA,NA,NA,N/A,NA,NA,NA,http://www.rottentomatoes.com/m/blair_witch_project/,1999-10-26,N/A,Artisan Pictures,http://www.blairwitch.com,True,NA,Rotten Tomatoes,87%
Woodstock,1970,R,1970-03-26,184 min,"Documentary, History, Music",Michael Wadleigh,N/A,"Richie Havens, Joan Baez, The Who, Sha-Na-Na",The film chronicle of the legendary 1969 music festival.,English,USA,Won 1 Oscar. Another 1 win & 2 nominations.,https://m.media-amazon.com/images/M/MV5BZjBiMDMzYzktOGMzOC00NzczLWE3YmYtZTgwNGIwZDRkYTE4XkEyXkFqcGdeQXVyNjc1NTYyMjg@._V1_SX300.jpg,N/A,8.1,14251,tt0066580,movie,N/A,NA,NA,NA,NA,N/A,NA,NA,NA,http://www.rottentomatoes.com/m/woodstock/,1997-09-25,N/A,WARNER BROTHERS PICTURES,N/A,True,NA,Rotten Tomatoes,100%
The Kentucky Fried Movie,1977,R,1977-08-10,83 min,Comedy,John Landis,"David Zucker, Jim Abrahams, Jerry Zucker","Marilyn Joi, Saul Kahan, David Zucker, Marcy Goldman","A series of short, highly irreverent, and often tasteless skits.","English, Korean",USA,N/A,https://m.media-amazon.com/images/M/MV5BOGRjZTJiMjYtNjkyZS00NTgwLWI3ODAtMDRlODdkMjQ2YjY3XkEyXkFqcGdeQXVyNjE5MjUyOTM@._V1_SX300.jpg,N/A,6.5,15547,tt0076257,movie,N/A,NA,NA,NA,NA,N/A,NA,NA,NA,http://www.rottentomatoes.com/m/kentucky_fried_movie/,2000-07-04,N/A,Best Film &amp; Video Corp.,N/A,True,NA,Rotten Tomatoes,80%
Mercy Streets,2000,PG-13,2000-10-31,106 min,"Action, Drama, Crime",Jon Gunn,"Jon Gunn, John W. Mann","Eric Roberts, David A.R. White, Cynthia Watros, Shiek Mahmud-Bey","Estranged twin brothers - one a con man, the other an Episcopal deacon - accidentally switch places... and find God in the process.",English,USA,N/A,https://images-na.ssl-images-amazon.com/images/M/MV5BNjIzNjI3ODAwN15BMl5BanBnXkFtZTcwMTY2Mjc0OQ@@._V1_SX300.jpg,28,5.5,463,tt0243415,movie,N/A,NA,NA,NA,NA,N/A,NA,NA,NA,http://www.rottentomatoes.com/m/mercy_streets/,2002-12-17,N/A,Sony Pictures Entertainment,N/A,True,NA,Rotten Tomatoes,13%
Broken Vessels,1998,R,1999-07-29,90 min,Drama,Scott Ziehl,"David Baer, Brent David Fraser (voice over co-writer), John McMahon, Scott Ziehl","Todd Field, Jason London, Roxana Zal, Susan Traylor",A young Pennsylvania man moves to Los Angeles to begin work for an ambulance service. There he is teamed with a supremely confident vet who seemingly has gone through a large number of ...,English,USA,1 win & 2 nominations.,https://m.media-amazon.com/images/M/MV5BMTM1MTIxNDI5M15BMl5BanBnXkFtZTcwMzA2NzUyMQ@@._V1_SX300.jpg,N/A,6.6,568,tt0149964,movie,N/A,NA,NA,NA,NA,N/A,NA,NA,NA,http://www.rottentomatoes.com/m/broken_vessels/,1999-11-09,N/A,Zeitgeist Films,N/A,True,NA,Rotten Tomatoes,67%
They Will Have to Kill Us First,2015,N/A,2016-03-04,100 min,Documentary,Johanna Schwartz,Andy Morgan,"Aliou Touré, Oumar Touré, Garba Touré, Nathanael Dembélé","Islamic extremists have banned music in Mali, but its world famous musicians wont give up without a fight. They Will Have To Kill Us First tells the story of Malis musicians, as they fight ...","French, Songhay, English, Bambara, Tamashek",UK,2 wins & 1 nomination.,https://images-na.ssl-images-amazon.com/images/M/MV5BMjIzNjkzODk4OF5BMl5BanBnXkFtZTgwNzEzODE3NDE@._V1_SX300.jpg,67,7.3,103,tt4333662,movie,N/A,NA,NA,NA,NA,N/A,NA,NA,NA,http://www.rottentomatoes.com/m/they_will_have_to_kill_us_first/,2016-09-20,N/A,Mojo Music,http://www.theywillhavetokillusfirst.com/,True,NA,Rotten Tomatoes,100%
The Maid's Room,2013,NOT RATED,2014-08-08,98 min,Thriller,Michael Walker,Michael Walker,"Paula Garcés, Annabella Sciorra, Bill Camp, Philip Ettinger","THE MAID'S ROOM is a psychological thriller that explores the complex relationships between truth and justice, hubris and power, wealth and fear.",English,USA,1 win & 1 nomination.,https://m.media-amazon.com/images/M/MV5BYTMwZTdhYzEtNjVhNi00NTVlLWE5ZWItNjM3Nzc1YTVlNjNhXkEyXkFqcGdeQXVyMTMxMTY0OTQ@._V1_SX300.jpg,39,4.5,853,tt2263814,movie,N/A,NA,NA,NA,NA,N/A,NA,NA,NA,http://www.rottentomatoes.com/m/the_maids_room/,NA,N/A,Paladin Films,http://www.facebook.com/TheMaidsRoom,True,NA,Rotten Tomatoes,27%
A Hard Day's Night,1964,G,1964-07-07,87 min,"Comedy, Music, Musical",Richard Lester,Alun Owen (original screenplay),"The Beatles, John Lennon, Paul McCartney, George Harrison","A ""typical"" day in the life of The Beatles, including many of their famous songs.","English, German, French",UK,Nominated for 2 Oscars. Another 2 wins & 5 nominations.,https://m.media-amazon.com/images/M/MV5BZjQyMGUwNzAtNTc2MC00Y2FjLThlM2ItZGRjNzM0OWVmZGYyXkEyXkFqcGdeQXVyNjc1NTYyMjg@._V1_SX300.jpg,96,7.7,36125,tt0058182,movie,N/A,NA,NA,NA,NA,N/A,NA,NA,NA,http://www.rottentomatoes.com/m/beatles_a_hard_days_night/,2002-09-24,N/A,Miramax,http://www.miramax.com/mm_front/owa/mp.entryPoint?action=0&amp;midStr=1069,True,NA,Rotten Tomatoes,98%
Fireproof,2008,PG,2008-09-26,122 min,"Drama, Romance",Alex Kendrick,"Alex Kendrick (story and screenplay), Stephen Kendrick (story and screenplay)","Kirk Cameron, Erin Bethea, Ken Bevel, Stephen Dervan","In an attempt to save his marriage, a firefighter uses a 40-day experiment known as ""The Love Dare.""",English,USA,N/A,https://m.media-amazon.com/images/M/MV5BMGZhYzFjY2ItNDVmZi00Y2Q1LWFmMDgtMzAwYTU3NTI3ZGU4XkEyXkFqcGdeQXVyMTMxMTY0OTQ@._V1_SX300.jpg,28,6.6,19410,tt1129423,movie,N/A,NA,NA,NA,NA,N/A,NA,NA,NA,http://www.rottentomatoes.com/m/10010214-fireproof/,2009-01-27,"$33,451,479",Sherwood Pictures,http://www.fireproofthemovie.com/,True,NA,Rotten Tomatoes,40%
Benji,1974,G,1974-10-17,86 min,"Adventure, Family, Romance",Joe Camp,Joe Camp,"Patsy Garrett, Allen Fiuzat, Cynthia Smith, Peter Breck",A stray dog saves two kidnapped children.,English,USA,Nominated for 1 Oscar. Another 1 win.,https://m.media-amazon.com/images/M/MV5BMzQzNjE2M2EtNzNjMC00ODYyLTk2NDgtY2Y2MWExZTFhN2Q4XkEyXkFqcGdeQXVyNzc5MjA3OA@@._V1_SX300.jpg,35,6.2,3956,tt0071206,movie,N/A,NA,NA,NA,NA,N/A,NA,NA,NA,http://www.rottentomatoes.com/m/benji/,2004-08-17,N/A,E1 Entertainment,N/A,True,NA,Rotten Tomatoes,86%
Open Water,2003,R,2004-08-20,79 min,"Adventure, Drama, Horror, Thriller",Chris Kentis,Chris Kentis,"Blanchard Ryan, Daniel Travis, Saul Stein, Michael E. Williamson",Based on the true story of two scuba divers accidentally stranded in shark infested waters after their tour boat has left.,English,USA,2 wins & 6 nominations.,https://m.media-amazon.com/images/M/MV5BNjQ5ODAyOTk3OF5BMl5BanBnXkFtZTcwNzQ1NjYyMQ@@._V1_SX300.jpg,63,5.7,47579,tt0374102,movie,N/A,NA,NA,NA,NA,N/A,NA,NA,NA,http://www.rottentomatoes.com/m/open_water/,2004-12-28,"$30,500,882",Lions Gate Films,http://www.openwatermovie.com/,True,NA,Rotten Tomatoes,71%
Kingdom of the Spiders,1977,PG,1977-11-01,97 min,"Horror, Sci-Fi",John 'Bud' Cardos,"Richard Robinson (screenplay), Alan Caillou (screenplay), Jeffrey M. Sneller (original story), Stephen Lodge (original story)","William Shatner, Tiffany Bolling, Woody Strode, Lieux Dressler","In rural Arizona, countless killer tarantulas are migrating through a farm town, killing every living thing in their path. The town's veterinarian will do everything in his power to survive the onslaught.",English,USA,3 nominations.,https://m.media-amazon.com/images/M/MV5BZmY4Yjk4M2MtMTUyYi00YWNmLTkxNmMtY2M3N2Y2NzU2MGM4XkEyXkFqcGdeQXVyNjUwMzI2NzU@._V1_SX300.jpg,N/A,5.9,3936,tt0076271,movie,N/A,NA,NA,NA,NA,N/A,NA,NA,NA,http://www.rottentomatoes.com/m/kingdom_of_the_spiders/,2003-09-16,N/A,Dimension Pictures,N/A,True,NA,Rotten Tomatoes,44%
Mad Hot Ballroom,2005,PG,2005-07-01,105 min,"Documentary, Family, Music",Marilyn Agrelo,Amy Sewell,"Heather Berman, Emma Therese Biegacki, Eva Carrozza, Evangelina Carrozzo",The students of several New York City elementary schools learn ballroom dancing and compete in a city wide dance competition.,"English, Spanish",USA,8 wins & 9 nominations.,https://m.media-amazon.com/images/M/MV5BNmI4NTdiYjYtMTk2OS00ZTliLTkyMjMtYTNkMzJhZTM2MTBkXkEyXkFqcGdeQXVyMTQxNzMzNDI@._V1_SX300.jpg,71,7.5,3247,tt0438205,movie,N/A,NA,NA,NA,NA,N/A,NA,NA,NA,http://www.rottentomatoes.com/m/mad_hot_ballroom/,2005-10-18,"$7,899,271",Paramount Classics,http://www.paramountclassics.com/madhot/,True,NA,Rotten Tomatoes,84%
The Station Agent,2003,R,2003-12-05,89 min,"Comedy, Drama",Tom McCarthy,Tom McCarthy,"Peter Dinklage, Paul Benjamin, Jase Blankfort, Paula Garcés","When his only friend dies, a man born with dwarfism moves to rural New Jersey to live a life of solitude, only to meet a chatty hot dog vendor and a woman dealing with her own personal loss.","English, Spanish",USA,Won 1 BAFTA Film Award. Another 28 wins & 31 nominations.,https://m.media-amazon.com/images/M/MV5BMTUzNDgyMzg3Ml5BMl5BanBnXkFtZTcwMzIxNTAwMQ@@._V1_SX300.jpg,81,7.7,63339,tt0340377,movie,N/A,NA,NA,NA,NA,N/A,NA,NA,NA,http://www.rottentomatoes.com/m/station_agent/,2004-06-15,N/A,Miramax Films,http://www.thestationagent.com/,True,NA,Rotten Tomatoes,94%
To Save a Life,2009,PG-13,2010-11-11,120 min,Drama,Brian Baugh,"Brian Baugh, Jim Britts","Randy Wayne, Deja Kreutzberg, Joshua Weigel, Steven Crowder","After a childhood friend's death, Jake Taylor, an all-star athlete must change his life - and sacrifice his dreams to save the lives of others.",English,USA,2 nominations.,https://m.media-amazon.com/images/M/MV5BMjAzMzgzMDI1OF5BMl5BanBnXkFtZTcwNTg3NjAwMw@@._V1_SX300.jpg,19,7.1,5086,tt1270286,movie,N/A,NA,NA,NA,NA,N/A,NA,NA,NA,http://www.rottentomatoes.com/m/to_save_a_life/,2010-08-03,"$3,700,734",IDP/Samuel goldwyn Films,http://www.tosavealifemovie.com/,True,NA,Rotten Tomatoes,36%
Wordplay,2006,PG,2006-07-21,94 min,Documentary,Patrick Creadon,"Patrick Creadon, Christine O'Malley","Will Shortz, Merl Reagle, Tyler Hinman, Trip Payne",An in-depth look at The New York Times' long-time crossword puzzle editor Will Shortz and his loyal fan base.,English,USA,1 win & 7 nominations.,https://m.media-amazon.com/images/M/MV5BMTkzNDMwODg5MV5BMl5BanBnXkFtZTYwMzU5NTc3._V1_SX300.jpg,73,7.4,3509,tt0492506,movie,N/A,NA,NA,NA,NA,N/A,NA,NA,NA,http://www.rottentomatoes.com/m/wordplay/,2006-11-07,"$2,857,745",IFC Films,http://www.wordplaymovie.com/,True,NA,Rotten Tomatoes,95%
Beyond the Mat,1999,R,2000-03-17,102 min,"Documentary, Biography, Sport",Barry W. Blaustein,Barry W. Blaustein (narrative written by),"Barry W. Blaustein, Vince McMahon, Jim Ross, Jim Bell","A heartfelt documentary focusing on the day-to-day lives of professional wrestlers, some on the rise, some on the wane, and others fighting for their lives.",English,USA,3 wins & 2 nominations.,https://m.media-amazon.com/images/M/MV5BMTQ5NDUzODkyOF5BMl5BanBnXkFtZTcwNjY3OTIyMQ@@._V1_SX300.jpg,73,7.6,7339,tt0218043,movie,N/A,NA,NA,NA,NA,N/A,NA,NA,NA,http://www.rottentomatoes.com/m/beyond_the_mat/,2000-08-22,N/A,Lions Gate Films,http://www.beyondthemat.net,True,NA,Rotten Tomatoes,82%
The Singles Ward,2002,PG,2002-01-30,102 min,"Comedy, Drama, Romance",Kurt Hale,"Kurt Hale, John E. Moyer","Will Swenson, Connie Young, Daryn Tufts, Kirby Heyborne","When Jonathan Jordan gets divorced he's thrust back into the world of being a single Mormon - a world who's ultimate goal is eternal marriage. Struggling to fit in, Jonathan decides to stop...",English,USA,N/A,https://images-na.ssl-images-amazon.com/images/M/MV5BMTQyNDAwNjc4M15BMl5BanBnXkFtZTYwMzQ5NDk5._V1_SX300.jpg,N/A,6.3,1183,tt0306069,movie,N/A,NA,NA,NA,NA,N/A,NA,NA,NA,http://www.rottentomatoes.com/m/the-singles-ward/,2006-03-28,"$1,136,236",Halestorm Entertainment,http://www.singleswardthemovie.com,True,NA,Rotten Tomatoes,50%
Osama,2003,PG-13,2003-06-27,83 min,Drama,Siddiq Barmak,Siddiq Barmak,"Marina Golbahari, Khwaja Nader, Mohammad Arif Herati, Zubaida Sahar","After the rise of the Taliban in Afghanistan and the restriction of women in public life, a pre-teen girl is forced to masquerade as a boy in order to find work to support her mother and grandmother.","Dari, Pushto, English, French","Afghanistan, Ireland, Japan",Won 1 Golden Globe. Another 14 wins & 13 nominations.,https://m.media-amazon.com/images/M/MV5BMTg3NTM5MDAxMF5BMl5BanBnXkFtZTcwNTk0OTQyMQ@@._V1_SX300.jpg,83,7.4,8188,tt0368913,movie,N/A,NA,NA,NA,NA,N/A,NA,NA,NA,http://www.rottentomatoes.com/m/osama/,2004-04-27,N/A,MGM,http://www.mgm.com/ua/osama/,True,NA,Rotten Tomatoes,96%
Sholem Aleichem: Laughing in the Darkness,2011,UNRATED,2011-07-08,93 min,Documentary,Joseph Dorman,Joseph Dorman,"Rachel Dratch, Hillel Halkin, Jason Kravits, Dan Miron",A riveting portrait of the great writer whose stories became the basis of the Broadway musical Fiddler on the Roof. Sholem Aleichem: Laughing in the Darkness tells the tale of the ...,English,USA,N/A,https://m.media-amazon.com/images/M/MV5BMjAyMTMwMDE3N15BMl5BanBnXkFtZTcwMDA5MTc4NQ@@._V1_SX300.jpg,77,6.8,157,tt1976608,movie,N/A,NA,NA,NA,NA,N/A,NA,NA,NA,http://www.rottentomatoes.com/m/sholem_aleichem_laughing_in_the_darkness_2011/,2013-03-11,"$906,666",International Film Circuit,http://www.sholemaleichemthemovie.com/,True,NA,Rotten Tomatoes,100%
Groove,2000,R,2000-10-19,86 min,"Drama, Music",Greg Harrison,Greg Harrison,"Chris Ferreira, Mackenzie Firgens, Elizabeth Sun, Steve Van Wormer",An inside look into one night in the San Francisco underground rave scene.,English,USA,2 nominations.,https://m.media-amazon.com/images/M/MV5BNjk1YTlhZjYtOThjMC00NTAxLTg4MWItNjFiNTExYjdlNDcxXkEyXkFqcGdeQXVyNTM0NTU5Mg@@._V1_SX300.jpg,54,6.5,3793,tt0212974,movie,N/A,NA,NA,NA,NA,N/A,NA,NA,NA,http://www.rottentomatoes.com/m/groove/,2000-12-05,N/A,Sony Pictures Classics,N/A,True,NA,Rotten Tomatoes,57%
The R.M.,2003,PG,2003-01-31,101 min,"Comedy, Crime, Family",Kurt Hale,"Kurt Hale, John E. Moyer","Kirby Heyborne, Daryn Tufts, Will Swenson, Britani Bateman",Jared Phelps (Kirby Heyborne) has completed two years of full-time missionary service for The Church of Jesus Christ of Latter-day Saints. His mission president has promised him that he ...,English,USA,N/A,http://ia.media-imdb.com/images/M/MV5BMTcyMTUyODAyM15BMl5BanBnXkFtZTYwMDc1NDk5._V1_SX300.jpg,N/A,6,651,tt0341540,movie,N/A,NA,NA,NA,NA,N/A,NA,NA,NA,http://www.rottentomatoes.com/m/1165800-rm/,2006-07-04,"$367,216",Halestorm Entertainment,http://www.rmthemovie.com,True,NA,Rotten Tomatoes,64%
Twin Falls Idaho,1999,R,2000-03-29,111 min,Drama,Michael Polish,"Mark Polish, Michael Polish","Mark Polish, Michael Polish, Michele Hicks, Jon Gries",Conjoined twins have their relationship tested when a woman takes interest in one of them.,English,USA,5 wins & 7 nominations.,https://images-na.ssl-images-amazon.com/images/M/MV5BMTkxNzkxMjUzNV5BMl5BanBnXkFtZTcwOTczNDMzMQ@@._V1_SX300.jpg,71,7.3,3539,tt0162830,movie,N/A,NA,NA,NA,NA,N/A,NA,NA,NA,http://www.rottentomatoes.com/m/twin_falls_idaho/,2000-01-18,N/A,Columbia TriStar,N/A,True,NA,Rotten Tomatoes,78%
Mean Creek,2004,R,2004-09-29,90 min,"Crime, Drama",Jacob Estes,Jacob Estes,"Rory Culkin, Ryan Kelley, Scott Mechlowicz, Trevor Morgan","When a teen is bullied, his brother and friends lure the bully into the woods to seek revenge.",English,USA,4 wins & 6 nominations.,https://m.media-amazon.com/images/M/MV5BMTc1NjAwNjI0Ml5BMl5BanBnXkFtZTYwMjY0NTU3._V1_SX300.jpg,74,7.2,28919,tt0377091,movie,N/A,NA,NA,NA,NA,N/A,NA,NA,NA,http://www.rottentomatoes.com/m/mean_creek/,2005-01-25,"$295,919",Paramount Classics,http://www.meancreekmovie.com/,True,NA,Rotten Tomatoes,89%
Hurricane Streets,1997,R,1998-02-19,86 min,"Crime, Drama, Romance",Morgan J. Freeman,Morgan J. Freeman,"Brendan Sexton III, Antoine McLean, Mtume Gant, Carlo Alban","Marcus is a kid on Manhattan's mean streets. He's turning 15, his father is dead, his mother is in prison for smuggling undocumented aliens. His grandmother is raising him. He has four ...",English,USA,3 wins & 2 nominations.,https://m.media-amazon.com/images/M/MV5BMTI5MTg5MjU3N15BMl5BanBnXkFtZTYwODEzMjY5._V1_SX300.jpg,N/A,6.5,1087,tt0119338,movie,N/A,NA,NA,NA,NA,N/A,NA,NA,NA,http://www.rottentomatoes.com/m/hurricane_streets/,1998-11-17,N/A,MGM Home Entertainment,N/A,True,NA,Rotten Tomatoes,88%
Never Again,2001,R,2001-03-11,98 min,"Comedy, Romance",Eric Schaeffer,Eric Schaeffer,"Jeffrey Tambor, Jill Clayburgh, Caroline Aaron, Bill Duke",Two people who have pledged never to fall in love again then discover each other in a gay bar.,English,USA,1 nomination.,https://images-na.ssl-images-amazon.com/images/M/MV5BMTgwMjA3MjAwNl5BMl5BanBnXkFtZTcwMjk0MDU1MQ@@._V1_SX300.jpg,30,6.1,737,tt0244094,movie,N/A,NA,NA,NA,NA,N/A,NA,NA,NA,http://www.rottentomatoes.com/m/never_again/,2003-01-28,"$196,147",USA Films,http://www.focusfeatures.com/,True,NA,Rotten Tomatoes,31%
Civil Brand,2002,R,2002-05-26,95 min,"Drama, Thriller, Crime",Neema Barnette,"Preston A. Whitmore II (story), Preston A. Whitmore II (teleplay), Joyce Renee Lewis (teleplay)","LisaRaye McCoy, N'Bushe Wright, Monica Calhoun, Clifton Powell",Women prisoners strike up a friendship with a young law student who works as a part-time prison guard. Together they discover that a corporation funds and is profitting from the ...,English,USA,4 wins & 1 nomination.,https://m.media-amazon.com/images/M/MV5BMTkyNDI4NTgyM15BMl5BanBnXkFtZTcwMTcwNDAwMQ@@._V1_SX300.jpg,29,5.4,616,tt0326806,movie,N/A,NA,NA,NA,NA,N/A,NA,NA,NA,http://www.rottentomatoes.com/m/civil_brand/,2004-01-27,"$123,580",Lions Gate Films,http://www.civilbrand.com,True,NA,Rotten Tomatoes,16%
Lonesome Jim,2005,R,2005-11-16,91 min,"Comedy, Drama",Steve Buscemi,Jim Strouse,"Casey Affleck, Kevin Corrigan, Mary Kay Place, Seymour Cassel","Failing to make it on his own, twenty-seven-year-old Jim moves back in with his parents and deals with crippling family obligations.",English,USA,1 win & 3 nominations.,https://m.media-amazon.com/images/M/MV5BNzU1MzgxNDYzOV5BMl5BanBnXkFtZTgwODQ3MzA0MTI@._V1_SX300.jpg,54,6.6,7337,tt0385056,movie,N/A,NA,NA,NA,NA,N/A,NA,NA,NA,http://www.rottentomatoes.com/m/lonesome_jim/,2006-08-09,N/A,IFC Films,http://www.mk2.com/lonesomejim/home.htm,True,NA,Rotten Tomatoes,60%
Drinking Buddies,2013,R,2013-07-25,90 min,"Comedy, Drama, Romance",Joe Swanberg,Joe Swanberg,"Olivia Wilde, Jake Johnson, Anna Kendrick, Ron Livingston",Luke and Kate are coworkers at a brewery who spend their nights drinking and flirting heavily. One weekend away together with their significant others proves who really belongs together and who doesn't.,English,USA,1 win & 3 nominations.,https://m.media-amazon.com/images/M/MV5BMjMwNDU1NzMzM15BMl5BanBnXkFtZTcwNTY3ODk1OQ@@._V1_SX300.jpg,71,6.1,53035,tt2265398,movie,N/A,NA,NA,NA,NA,N/A,NA,NA,NA,http://www.rottentomatoes.com/m/drinking_buddies_2013/,2013-12-03,"$200,000",Magnolia Pictures,http://www.magpictures.com/drinkingbuddies/,True,NA,Rotten Tomatoes,83%
Deceptive Practice: The Mysteries and Mentors of Ricky Jay,2012,NOT RATED,2012-10-04,88 min,Documentary,Molly Bernstein,N/A,"Ricky Jay, Winston Simone, Dick Cavett, David Mamet","Ricky Jay is a world-renowned magician, author, historian and actor (often a mischievous presence in the films of David Mamet and Paul Thomas Anderson) -- and a performer who regularly ...",English,USA,N/A,https://m.media-amazon.com/images/M/MV5BMTQ5MzM3NjQ5Ml5BMl5BanBnXkFtZTcwMzcyNTYzOQ@@._V1_SX300.jpg,79,7.1,867,tt2654360,movie,N/A,NA,NA,NA,NA,N/A,NA,NA,NA,http://www.rottentomatoes.com/m/deceptive_practice_the_mysteries_and_mentors_of_ricky_jay/,2013-11-04,"$151,389",Kino Lorber Films,http://rickyjay.com/,True,NA,Rotten Tomatoes,92%
Seven Samurai,1954,Not Rated,1956-11-19,207 min,"Adventure, Drama",Akira Kurosawa,"Akira Kurosawa (screenplay), Shinobu Hashimoto (screenplay), Hideo Oguni (screenplay)","Toshirô Mifune, Takashi Shimura, Keiko Tsushima, Yukiko Shimazaki",A poor village under attack by bandits recruits seven unemployed samurai to help them defend themselves.,Japanese,Japan,Nominated for 2 Oscars. Another 5 wins & 6 nominations.,https://m.media-amazon.com/images/M/MV5BMTRjZTc3NjItMDJiMC00MTNmLTlkYjEtN2ZiZWU4YmI1OGI4XkEyXkFqcGdeQXVyNzkwMjQ5NzM@._V1_SX300.jpg,98,8.7,277323,tt0047478,movie,N/A,NA,NA,NA,NA,N/A,NA,NA,NA,http://www.rottentomatoes.com/m/1018639-seven_samurai/,1999-03-01,N/A,Columbia Pictures,N/A,True,NA,Rotten Tomatoes,100%
The Other Dream Team,2012,Not Rated,2012-09-28,89 min,"Documentary, Sport",Marius A. Markevicius,"Marius A. Markevicius, Jon Weinbach","Jim Lampley, Bill Walton, David Remnick, Greg Speirs","The incredible story of the 1992 Lithuanian basketball team, whose athletes struggled under Soviet rule, became symbols of Lithuania's independence movement, and - with help from the Grateful Dead - triumphed at the Barcelona Olympics.","English, Lithuanian","USA, Lithuania",3 nominations.,https://m.media-amazon.com/images/M/MV5BODg5MzQ3NTA5OV5BMl5BanBnXkFtZTcwNTYxMTEzOA@@._V1_SX300.jpg,69,8.4,3295,tt1606829,movie,N/A,NA,NA,NA,NA,N/A,NA,NA,NA,http://www.rottentomatoes.com/m/the_other_dream_team_2012/,2013-01-14,"$133,778",The Film Arcade,http://www.theotherdreamteam.com/,True,NA,Rotten Tomatoes,87%
Johnny Suede,1991,R,1992-04-22,97 min,"Comedy, Music, Romance",Tom DiCillo,Tom DiCillo,"Brad Pitt, Richard Boes, Cheryl Costa, Michael Luciano",A struggling young musician and devoted fan of Ricky Nelson wants to be just like his idol and become a rock star.,English,"Switzerland, France, USA",1 win & 3 nominations.,https://m.media-amazon.com/images/M/MV5BNWMxYTE3M2EtOWI3Yi00MWU2LWFmYjQtMmE0YTU3NDJiMGYxXkEyXkFqcGdeQXVyMTQ4NDY5OTc@._V1_SX300.jpg,53,5.8,3387,tt0104567,movie,N/A,NA,NA,NA,NA,N/A,NA,NA,NA,http://www.rottentomatoes.com/m/johnny_suede/,2005-08-30,N/A,Miramax Films,N/A,True,NA,Rotten Tomatoes,33%
Finishing the Game: The Search for a New Bruce Lee,2007,NOT RATED,2007-01-21,84 min,Comedy,Justin Lin,"Josh Diamond, Justin Lin","Josh Diamond, Sam Bottoms, Jake Sandvig, Roger Fan","Bruce Lee's shocking death left legions of stunned fans and a legacy of 12 minutes from his unfinished Game Of Death. Undeterred, studio executives launched a search for his replacement chronicled here through the eyes of five aspiring thespians who find out what the real game is.",English,USA,1 win.,https://images-na.ssl-images-amazon.com/images/M/MV5BMTA3MjczMTUxODReQTJeQWpwZ15BbWU3MDQ2MTA1NTE@._V1_SX300.jpg,46,6.1,1683,tt0843850,movie,N/A,NA,NA,NA,NA,N/A,NA,NA,NA,http://www.rottentomatoes.com/m/finishing_the_game/,2008-06-24,N/A,IFC First Take,http://www.myspace.com/FinishingTheGame,True,NA,Rotten Tomatoes,35%
Rubber,2010,R,2010-11-10,82 min,"Comedy, Fantasy, Horror",Quentin Dupieux,Quentin Dupieux,"Stephen Spinella, Jack Plotnick, Wings Hauser, Roxane Mesquida","A homicidal car tire, discovering it has destructive psionic power, sets its sights on a desert town once a mysterious woman becomes its obsession.",English,"France, Angola, USA",5 wins & 2 nominations.,https://m.media-amazon.com/images/M/MV5BZTY2NTY4MzctMWNkYy00NWM4LTliOWQtMWExZDU1ZWQxNTQxXkEyXkFqcGdeQXVyNTIzOTk5ODM@._V1_SX300.jpg,59,5.8,30772,tt1612774,movie,N/A,NA,NA,NA,NA,N/A,NA,NA,NA,http://www.rottentomatoes.com/m/rubber/,2011-06-07,"$100,000",Magnolia Releasing,http://www.rubberfilm.com/,True,NA,Rotten Tomatoes,68%
Home,2015,PG,2015-03-27,94 min,"Animation, Adventure, Comedy, Family, Fantasy, Sci-Fi",Tim Johnson,"Tom J. Astle (screenplay by), Matt Ember (screenplay by), Adam Rex (book)","Jim Parsons, Rihanna, Steve Martin, Jennifer Lopez","An alien on the run from his own people makes friends with a girl. He tries to help her on her quest, but can be an interference.","English, French",USA,2 wins & 9 nominations.,https://m.media-amazon.com/images/M/MV5BMjExOTQ4MDMyMV5BMl5BanBnXkFtZTgwMTE3NDM2MzE@._V1_SX300.jpg,55,6.6,84407,tt2224026,movie,N/A,NA,NA,NA,NA,N/A,NA,NA,NA,http://www.rottentomatoes.com/m/home_2015/,2015-07-28,"$157,801,252",DreamWorks Animation,http://www.meettheboov.com/,True,NA,Rotten Tomatoes,50%
Kiss the Bride,2007,R,2007-07-23,100 min,"Comedy, Romance",C. Jay Cox,Tyler Lieberman,"Tori Spelling, Philipp Karner, James O'Shea, Joanna Cassidy","In high school, Matt and Ryan were best friends. More than friends, actually. But in the ensuing ten years, they've lost contact. So when Matt receives an invitation to Ryan's wedding he's ...",English,USA,N/A,https://images-na.ssl-images-amazon.com/images/M/MV5BMTg1ODgwODU4M15BMl5BanBnXkFtZTcwOTY0ODU2MQ@@._V1_SX300.jpg,N/A,5.7,1431,tt0893346,movie,N/A,NA,NA,NA,NA,N/A,NA,NA,NA,http://www.rottentomatoes.com/m/kiss_the_bride_2008/,2008-11-25,N/A,Regent Releasing,http://kissthebridemovie.com/,True,NA,Rotten Tomatoes,29%
