Title,Year,Rated,Released,Runtime,Genre,Director,Writer,Actors,Plot,Language,Country,Awards,Poster,Metascore,imdbRating,imdbVotes,imdbID,Type,tomatoImage,tomatoRating,tomatoReviews,tomatoFresh,tomatoRotten,tomatoConsensus,tomatoUserMeter,tomatoUserRating,tomatoUserReviews,tomatoURL,DVD,BoxOffice,Production,Website,Response,totalSeasons,ratingSite,tomatoMeter
The Brave Little Toaster,1987,Not Rated,1987-07-10,90 min,"Animation, Adventure, Family, Fantasy",Jerry Rees,"Thomas M. Disch (based on the novella by), Jerry Rees (screenplay by), Joe Ranft (screenplay by), Jerry Rees (screen story by), Joe Ranft (screen story by), Brian McEntee (screen story by)","Jon Lovitz, Timothy Stack, Timothy E. Day, Thurl Ravenscroft",A group of dated appliances embarks on a journey to the city to find its master after being abandoned in its cabin in the woods.,English,"USA, Taiwan, Japan",Nominated for 1 Primetime Emmy. Another 1 win & 3 nominations.,https://m.media-amazon.com/images/M/MV5BNTFhYmVmYjQtZDc0Yi00OTEzLWI4NjItZGQ4YWFmOGZlMDY4XkEyXkFqcGdeQXVyNzA5MzkyOTM@._V1_SX300.jpg,N/A,7.3,22009,tt0092695,movie,N/A,NA,NA,NA,NA,N/A,NA,NA,NA,http://www.rottentomatoes.com/m/brave_little_toaster/,2003-09-02,N/A,Kushner-Locke Productions,N/A,True,NA,Rotten Tomatoes,75%
Fantasia,1940,G,1941-06-20,125 min,"Animation, Family, Fantasy, Music","James Algar, Samuel Armstrong, Ford Beebe Jr., Norman Ferguson, David Hand, Jim Handley, T. Hee, Wilfred Jackson, Hamilton Luske, Bill Roberts, Paul Satterfield, Ben Sharpsteen","Joe Grant (story direction), Dick Huemer (story direction), Lee Blair (story development), Elmer Plummer (story development), Phil Dike (story development), Sylvia Moberly-Holland (story development), Norman Wright (story development), Albert Heath (story development), Bianca Majolie (story development), Graham Heid (story development), Perce Pearce (story development), Carl Fallberg (story development), William Martin (story development and research), Leo Thiele (story development and research), Robert Sterner (story development and research), John McLeish (story development and research), Otto Englander (story development), Webb Smith (story development), Erdman Penner (story development), Joseph Sabo (story development), Bill Peet (story development), Vernon Stallings (story development), Campbell Grant (story development), Arthur Heinemann (story development), Phil Dike (story development)","Leopold Stokowski, Deems Taylor",A collection of animated interpretations of great works of Western classical music.,English,USA,8 wins & 1 nomination.,https://m.media-amazon.com/images/M/MV5BYjhlYzNkOGEtZjNkZC00OTQ4LWJiMzEtMTM3YzBiM2FkMDUxXkEyXkFqcGdeQXVyNzY1NDgwNjQ@._V1_SX300.jpg,96,7.8,80987,tt0032455,movie,N/A,NA,NA,NA,NA,N/A,NA,NA,NA,http://www.rottentomatoes.com/m/fantasia/,1991-10-25,N/A,Walt Disney Productions,N/A,True,NA,Rotten Tomatoes,96%
The French Connection,1971,R,1971-10-09,104 min,"Action, Crime, Drama, Thriller",William Friedkin,"Ernest Tidyman (screenplay by), Robin Moore (based on the book by)","Gene Hackman, Fernando Rey, Roy Scheider, Tony Lo Bianco",A pair of NYC cops in the Narcotics Bureau stumble onto a drug smuggling job with a French connection.,"English, French",USA,Won 5 Oscars. Another 17 wins & 10 nominations.,https://m.media-amazon.com/images/M/MV5BOTZhY2E3NmItMGIwNi00OTA2LThkYmEtODFiZTM0NGI0ZWU5XkEyXkFqcGdeQXVyNTc1NTQxODI@._V1_SX300.jpg,96,7.8,97839,tt0067116,movie,N/A,NA,NA,NA,NA,N/A,NA,NA,NA,http://www.rottentomatoes.com/m/french_connection/,2001-09-25,N/A,20th Century Fox,N/A,True,NA,Rotten Tomatoes,98%
Friday the 13th Part III,1982,R,1982-08-13,95 min,"Horror, Thriller",Steve Miner,"Martin Kitrosser (screenplay), Carol Watson (screenplay), Victor Miller (character creator), Ron Kurz (character creator)","Terry Ballard, Richard Brooker, Gloria Charles, Rachel Howard","Having revived from his wounds, Jason Voorhees takes refuge at a cabin near Crystal Lake. As a group of co-eds arrive for their vacation, Jason continues his killing spree.",English,USA,2 nominations.,https://m.media-amazon.com/images/M/MV5BZjRiMTdlY2QtZGE3YS00YjQzLTk5MmUtNjVjMjUzYWRiMWNhXkEyXkFqcGdeQXVyMTQxNzMzNDI@._V1_SX300.jpg,30,5.7,40342,tt0083972,movie,N/A,NA,NA,NA,NA,N/A,NA,NA,NA,http://www.rottentomatoes.com/m/friday_the_13th_part_3/,2000-10-17,N/A,Paramount Home Video,N/A,True,NA,Rotten Tomatoes,12%
Friday the 13th: A New Beginning,1985,R,1985-03-22,92 min,"Horror, Mystery, Thriller",Danny Steinmann,"Martin Kitrosser (story), David Cohen (story), Martin Kitrosser (screenplay), David Cohen (screenplay), Danny Steinmann (screenplay)","Anthony Barrile, Suzanne Bateman, Dominick Brascia, Todd Bryant","Still haunted by his past, Tommy Jarvis - who, as a child, killed Jason Voorhees - wonders if the serial killer is connected to a series of brutal murders occurring in and around the secluded halfway house where he now lives.",English,USA,2 nominations.,https://m.media-amazon.com/images/M/MV5BYjNkNzEwOWYtMjY4Ni00YjIwLTgyZGQtMmYwNmVmYWFlZDJhXkEyXkFqcGdeQXVyNDgxODg1MzU@._V1_SX300.jpg,16,4.8,28560,tt0089173,movie,N/A,NA,NA,NA,NA,N/A,NA,NA,NA,http://www.rottentomatoes.com/m/friday_the_13th_part_5_a_new_beginning/,2001-09-25,N/A,Paramount Pictures,N/A,True,NA,Rotten Tomatoes,16%
The Last Sin Eater,2007,PG-13,2007-02-09,117 min,Drama,Michael Landon Jr.,"Brian Bird (screenplay), Michael Landon Jr. (screenplay), Francine Rivers (novel)","Louise Fletcher, Henry Thomas, Liana Liberato, Soren Fulton","In seeking her own redemption from the man of whom she is most afraid, ten-year-old Cadi Forbes discovers a secret sin haunting her community of Welsh immigrants in 1850s Appalachia.",English,USA,1 win.,https://m.media-amazon.com/images/M/MV5BMTIyMjIzNTgzN15BMl5BanBnXkFtZTcwNzA2NTQ0MQ@@._V1_SX300.jpg,37,5.9,1693,tt0810928,movie,N/A,NA,NA,NA,NA,N/A,NA,NA,NA,http://www.rottentomatoes.com/m/last_sin_eater/,2007-05-15,"$246,483",Fox Faith Films,http://www.foxfaithmovies.com/thelastsineater/,True,NA,Rotten Tomatoes,19%
Do You Believe?,2015,PG-13,2015-03-20,120 min,Drama,Jon Gunn,"Chuck Konzelman, Cary Solomon","Grifon Aldren, Sean Astin, Brian Bosworth, Valerie Domínguez","When a pastor is shaken by the visible faith of a street corner preacher, he is reminded that true belief always requires action. His response ignites a journey that impacts everyone it touches in ways that only God could orchestrate.",English,USA,1 nomination.,https://m.media-amazon.com/images/M/MV5BMjE5MzAxMjUyMl5BMl5BanBnXkFtZTgwNDk1OTMwNDE@._V1_SX300.jpg,22,6.2,6304,tt4056738,movie,N/A,NA,NA,NA,NA,N/A,NA,NA,NA,http://www.rottentomatoes.com/m/do_you_believe/,2015-08-04,"$9,172,156",Freestyle Releasing,http://www.doyoubelieve.com,True,NA,Rotten Tomatoes,21%
Always Woodstock,2014,N/A,2014-11-14,97 min,"Comedy, Music, Romance",Rita Merson,Rita Merson,"Allison Miller, James Wolk, Rumer Willis, Jason Ritter","When Neurotic, struggling songwriter, Catherine Brown's life in New York City falls apart, she is forced to confront her past when she spends the summer at her childhood home in Woodstock, ...",English,USA,N/A,https://m.media-amazon.com/images/M/MV5BMjIzNzI2NDA3Ml5BMl5BanBnXkFtZTgwNDkyNDUwMzE@._V1_SX300.jpg,30,5.4,644,tt1995477,movie,N/A,NA,NA,NA,NA,N/A,NA,NA,NA,http://www.rottentomatoes.com/m/always_woodstock/,2015-04-27,N/A,Gravitas Ventures,http://www.gravitasventures.com/always-woodstock/,True,NA,Rotten Tomatoes,8%
Jack Brooks: Monster Slayer,2007,R,2008-11-19,85 min,"Action, Comedy, Horror, Sci-Fi",Jon Knautz,"Jon Knautz (story), Trevor Matthews (story), Patrick White (story), John Ainslie (story), Jon Knautz (screenplay), John Ainslie (screenplay)","Robert Englund, Trevor Matthews, Daniel Kash, David Fox",A troubled young man still mourning the childhood loss of his family now has to deal with his professor being turned into a monster.,English,Canada,3 wins & 6 nominations.,https://m.media-amazon.com/images/M/MV5BOGNiNjMyYWMtYWMwZC00MDgwLTllNzMtYjUzNzVhNjRhYjNiXkEyXkFqcGdeQXVyNzg3NjQyOQ@@._V1_SX300.jpg,46,6,5657,tt0816539,movie,N/A,NA,NA,NA,NA,N/A,NA,NA,NA,http://www.rottentomatoes.com/m/jack_brooks_monster_slayer/,2008-10-07,N/A,Anchor Bay Entertainment,http://www.brookstreetpictures.com/jackbrooks,True,NA,Rotten Tomatoes,59%
The Best Years of Our Lives,1946,APPROVED,1947-05-29,170 min,"Drama, Romance, War",William Wyler,"Robert E. Sherwood (screen play), MacKinlay Kantor (from a novel by)","Myrna Loy, Fredric March, Dana Andrews, Teresa Wright",Three World War II veterans return home to small-town America to discover that they and their families have been irreparably changed.,English,USA,Won 7 Oscars. Another 14 wins & 2 nominations.,https://m.media-amazon.com/images/M/MV5BY2RmNTRjYzctODI4Ni00MzQyLWEyNTAtNjU0N2JkMTNhNjJkXkEyXkFqcGdeQXVyNjU0OTQ0OTY@._V1_SX300.jpg,92,8.1,52137,tt0036868,movie,N/A,NA,NA,NA,NA,N/A,NA,NA,NA,http://www.rottentomatoes.com/m/best_years_of_our_lives/,1997-10-30,N/A,RKO Radio Pictures,N/A,True,NA,Rotten Tomatoes,96%
Bully,2001,R,2001-12-12,108 min,"Biography, Crime, Drama",Larry Clark,"Jim Schutze (book), David McKenna (screenplay), Roger Pullis (screenplay)","Brad Renfro, Bijou Phillips, Rachel Miner, Nick Stahl","A pack of naïve teenagers conspire to murder a mutual friend, whose aggressive demeanor has proved too much.",English,"USA, France, UK",3 wins & 1 nomination.,https://m.media-amazon.com/images/M/MV5BNGY2NjNkYjEtY2M5Ni00NzQwLTk1MjctYjEzOWFmNWE2NGZjL2ltYWdlXkEyXkFqcGdeQXVyMTQxNzMzNDI@._V1_SX300.jpg,45,7,32102,tt0242193,movie,N/A,NA,NA,NA,NA,N/A,NA,NA,NA,http://www.rottentomatoes.com/m/bully/,2002-01-29,N/A,Lions Gate Films,http://www.bullythemovie.com,True,NA,Rotten Tomatoes,54%
Elling,2001,R,2001-03-16,89 min,"Comedy, Drama",Petter Næss,"Ingvar Ambjørnsen (novel), Axel Hellstenius, Larry Stuckey","Per Christian Ellefsen, Sven Nordin, Marit Pia Jacobsen, Jørgen Langhelle","When his mother, who has sheltered him his entire 40 years, dies, Elling, a sensitive, would-be poet, is sent to live in a state institution. There he meets Kjell Bjarne, a gentle giant and...",Norwegian,Norway,Nominated for 1 Oscar. Another 14 wins & 4 nominations.,https://m.media-amazon.com/images/M/MV5BMzczMzg1NzM3Nl5BMl5BanBnXkFtZTYwNjQ5ODc5._V1_SX300.jpg,70,7.6,13305,tt0279064,movie,N/A,NA,NA,NA,NA,N/A,NA,NA,NA,http://www.rottentomatoes.com/m/elling/,2002-11-19,"$63,227",First Look Pictures,http://www.elling.nu,True,NA,Rotten Tomatoes,85%
Mi America,2015,R,2015-10-16,90 min,"Crime, Drama",Robert Fontaine,Robert Fontaine,"Robert Fontaine, Michael Brainard, Grant Boyd, Michael Derek","A hate-crime has been committed in a the small city of Braxton, N.Y. Five migrant laborers have been beaten, shot, then ditched. This will upset the delicate balance of an ethnically diverse populace.","English, Spanish",USA,N/A,https://images-na.ssl-images-amazon.com/images/M/MV5BMjQxNzc3MDE0OF5BMl5BanBnXkFtZTgwNjQwMTg3NjE@._V1_SX300.jpg,N/A,7,33,tt2460506,movie,N/A,NA,NA,NA,NA,N/A,NA,NA,NA,http://www.rottentomatoes.com/m/mi_america/,NA,N/A,N/A,N/A,True,NA,Rotten Tomatoes,50%
[Rec],2007,R,2007-11-23,78 min,"Horror, Mystery, Thriller","Jaume Balagueró, Paco Plaza","Jaume Balagueró (screenplay), Luiso Berdejo (screenplay), Paco Plaza (screenplay)","Manuela Velasco, Ferran Terraza, Jorge-Yamam Serrano, Pablo Rosso",A television reporter and cameraman follow emergency workers into a dark apartment building and are quickly locked inside with something terrifying.,"Spanish, Japanese",Spain,16 wins & 12 nominations.,https://m.media-amazon.com/images/M/MV5BZTJmNTZlZWUtZTQ2Yi00YTFjLWFiNzctYzFlNmZmZGMzYTlmXkEyXkFqcGdeQXVyMjQ2MTk1OTE@._V1_SX300.jpg,69,7.5,150682,tt1038988,movie,N/A,NA,NA,NA,NA,N/A,NA,NA,NA,http://www.rottentomatoes.com/m/10009132-rec/,2009-07-14,N/A,Odeon Sky Filmworks,http://www.3l-filmverleih.de/rec/rec_1.html,True,NA,Rotten Tomatoes,88%
Containment,2015,TV-14,2015-08-01,77 min,"Horror, Sci-Fi, Thriller",Neil Mcenery-West,"David Lemon (screenplay), David Lemon, Neil Mcenery-West (story), Antony Woodruffe (story support)","Louise Brealey, Billy Postlethwaite, Lee Ross, Sheila Reid","What happens when an epidemic breaks out, but you're kept in the dark? Anything can happen. Slowly the residents realize that they will all die unless they come together.",English,UK,7 wins & 2 nominations.,https://m.media-amazon.com/images/M/MV5BMTQzNDEwOTk4N15BMl5BanBnXkFtZTgwNjA5Njk2NTE@._V1_SX300.jpg,N/A,4.9,1868,tt3561236,movie,N/A,NA,NA,NA,NA,N/A,NA,NA,NA,http://www.rottentomatoes.com/m/containment_2015/,NA,N/A,N/A,N/A,True,NA,Rotten Tomatoes,90%
From Russia with Love,1963,PG,1964-05-27,115 min,"Action, Adventure, Thriller",Terence Young,"Richard Maibaum (screenplay), Johanna Harwood (adaptation)","Sean Connery, Daniela Bianchi, Pedro Armendáriz, Lotte Lenya",James Bond willingly falls into an assassination ploy involving a naive Russian beauty in order to retrieve a Soviet encryption device that was stolen by SPECTRE.,"English, Russian, Turkish, Romany",UK,Nominated for 1 Golden Globe. Another 3 wins & 5 nominations.,https://m.media-amazon.com/images/M/MV5BMTQxNTIzMTExN15BMl5BanBnXkFtZTcwODI4MDgzNA@@._V1_SX300.jpg,85,7.5,103608,tt0057076,movie,N/A,NA,NA,NA,NA,N/A,NA,NA,NA,http://www.rottentomatoes.com/m/from_russia_with_love/,2006-03-28,N/A,United Artists,N/A,True,NA,Rotten Tomatoes,96%
The Toxic Avenger Part II,1989,R,1989-02-24,102 min,"Action, Comedy, Horror, Sci-Fi","Michael Herz, Lloyd Kaufman","Lloyd Kaufman (story), Gay Partington Terry (screenplay), Lloyd Kaufman (screenplay), Pericles Lewnes (additional material), Fumio Furuya (additional material), Yoshiko Miyamoto (additional material), Andrew Wolk (additional material), Phil Rivo (additional material)","Ron Fazio, John Altamura, Phoebe Legere, Rick Collins","The Toxic Avenger is tricked into traveling to Tokyo to search for his estranged father, leaving Tromaville open to complete domination by an evil corporation.","English, Japanese, Russian",USA,1 nomination.,https://m.media-amazon.com/images/M/MV5BODhiNTljYTctMmIzZC00ZGVkLTk2NmItN2RjMzY3ZTYyNDczXkEyXkFqcGdeQXVyMTQxNzMzNDI@._V1_SX300.jpg,N/A,5.1,5500,tt0098503,movie,N/A,NA,NA,NA,NA,N/A,NA,NA,NA,http://www.rottentomatoes.com/m/the_toxic_avenger_part_ii_1989/,2008-04-29,N/A,Lorimar Productions,N/A,True,NA,Rotten Tomatoes,0%
Sleeper,1973,PG,1973-12-17,89 min,"Comedy, Sci-Fi",Woody Allen,"Woody Allen, Marshall Brickman","Woody Allen, Diane Keaton, John Beck, Mary Gregory",A nerdish store owner is revived out of cryostasis into a future world to fight an oppressive government.,"English, Yiddish",USA,2 wins & 2 nominations.,https://m.media-amazon.com/images/M/MV5BMTUzMzY1MzI3Nl5BMl5BanBnXkFtZTcwOTM4OTYwNA@@._V1_SX300.jpg,77,7.3,37117,tt0070707,movie,N/A,NA,NA,NA,NA,N/A,NA,NA,NA,http://www.rottentomatoes.com/m/sleeper/,2000-07-05,N/A,United Artists,N/A,True,NA,Rotten Tomatoes,100%
It Follows,2014,R,2015-03-27,100 min,"Horror, Mystery",David Robert Mitchell,David Robert Mitchell,"Bailey Spry, Carollette Phillips, Loren Bass, Keir Gilchrist",A young woman is followed by an unknown supernatural force after a sexual encounter.,English,USA,24 wins & 41 nominations.,https://m.media-amazon.com/images/M/MV5BMmU0MjBlYzYtZWY0MC00MjliLWI3ZmUtMzhlZDVjMWVmYWY4XkEyXkFqcGdeQXVyMTQxNzMzNDI@._V1_SX300.jpg,83,6.8,178000,tt3235888,movie,N/A,NA,NA,NA,NA,N/A,NA,NA,NA,http://www.rottentomatoes.com/m/it_follows/,2015-07-14,"$10,705,259",Radius-TWC,http://www.itfollowsfilm.com/,True,NA,Rotten Tomatoes,96%
Everything You Always Wanted to Know About Sex * But Were Afraid to Ask,1972,R,1973-01-31,88 min,Comedy,Woody Allen,"David Reuben (from the book ""Everything You Always Wanted to Know About Sex * But Were Afraid to Ask"" by), Woody Allen (written for the screen by)","Woody Allen, John Carradine, Lou Jacobi, Louise Lasser",Seven stories are trying to answer the question: what is sex? Or maybe they are not trying.,"English, Italian",USA,N/A,https://m.media-amazon.com/images/M/MV5BMTQ2ODA3Mzc3Ml5BMl5BanBnXkFtZTcwNTkyNzYzNA@@._V1_SX300.jpg,66,6.8,35437,tt0068555,movie,N/A,NA,NA,NA,NA,N/A,NA,NA,NA,http://www.rottentomatoes.com/m/everything_you_always_wanted_to_know_about_sex_but_were_afraid_to_ask/,2000-07-05,N/A,United Artists,N/A,True,NA,Rotten Tomatoes,90%
To Kill a Mockingbird,1962,Not Rated,1963-03-16,129 min,"Crime, Drama",Robert Mulligan,"Harper Lee (based on her novel ""To Kill a Mockingbird""), Horton Foote (screenplay)","Gregory Peck, John Megna, Frank Overton, Rosemary Murphy","Atticus Finch, a lawyer in the Depression-era South, defends a black man against an undeserved rape charge, and his children against prejudice.",English,USA,Won 3 Oscars. Another 10 wins & 16 nominations.,https://m.media-amazon.com/images/M/MV5BNmVmYzcwNzMtMWM1NS00MWIyLThlMDEtYzUwZDgzODE1NmE2XkEyXkFqcGdeQXVyNzkwMjQ5NzM@._V1_SX300.jpg,87,8.3,266124,tt0056592,movie,N/A,NA,NA,NA,NA,N/A,NA,NA,NA,http://www.rottentomatoes.com/m/to_kill_a_mockingbird/,1998-04-28,N/A,Universal International Pictur,N/A,True,NA,Rotten Tomatoes,91%
The Road Warrior,1981,R,1982-05-21,94 min,"Action, Adventure, Sci-Fi, Thriller",George Miller,"Terry Hayes (screenplay by), George Miller (screenplay by), Brian Hannant (screenplay with)","Mel Gibson, Bruce Spence, Michael Preston, Max Phipps","In the post-apocalyptic Australian wasteland, a cynical drifter agrees to help a small, gasoline rich community escape a horde of bandits.",English,Australia,8 wins & 10 nominations.,https://m.media-amazon.com/images/M/MV5BN2VlNjNhZWQtMTY2OC00Y2E1LWJkNGUtMDU4M2ViNzliMGYwXkEyXkFqcGdeQXVyNTAyODkwOQ@@._V1_SX300.jpg,77,7.6,152866,tt0082694,movie,N/A,NA,NA,NA,NA,N/A,NA,NA,NA,http://www.rottentomatoes.com/m/mad_max_2_the_road_warrior_1981/,1997-09-25,N/A,Warner Bros. Pictures,N/A,True,NA,Rotten Tomatoes,98%
Drunken Master II,1994,R,2000-10-20,102 min,"Action, Comedy",Chia-Liang Liu,"Edward Tang (screenplay), Man-Ming Tong (screenplay), Kai-Chi Yuen (screenplay), Rod Dean (english adaptation)","Jackie Chan, Lung Ti, Anita Mui, Felix Wong",A young martial artist is caught between respecting his pacifist father's wishes or stopping a group of disrespectful foreigners from stealing precious artifacts.,Cantonese,Hong Kong,3 wins & 1 nomination.,https://m.media-amazon.com/images/M/MV5BZmRiZTZiMWEtZGVlNS00YzU1LTkxZjYtODNiMDEyYTIxYjA0XkEyXkFqcGdeQXVyMTQxNzMzNDI@._V1_SX300.jpg,74,7.6,39541,tt0111512,movie,N/A,NA,NA,NA,NA,N/A,NA,NA,NA,http://www.rottentomatoes.com/m/legend_of_drunken_master/,2001-03-20,N/A,Dimension Films,http://www.dimensionfilms.com/mm_front/owa/dim_movie_page.entryPoint?midStr=1422,True,NA,Rotten Tomatoes,83%
Lolita,1962,Not Rated,1962-06-21,153 min,"Crime, Drama, Romance",Stanley Kubrick,"Vladimir Nabokov (screenplay), Vladimir Nabokov (novel)","James Mason, Shelley Winters, Sue Lyon, Gary Cockrell",A middle-aged college professor becomes infatuated with a fourteen-year-old nymphet.,"English, French, Spanish, German","UK, USA",Nominated for 1 Oscar. Another 2 wins & 8 nominations.,https://m.media-amazon.com/images/M/MV5BYjliZjQ1NGMtNjU1MS00M2RmLThkN2UtM2NlNTJjM2FjYTk1XkEyXkFqcGdeQXVyMjgyNjk3MzE@._V1_SX300.jpg,N/A,7.6,80978,tt0056193,movie,N/A,NA,NA,NA,NA,N/A,NA,NA,NA,http://www.rottentomatoes.com/m/1012611-lolita/,1999-06-29,N/A,MGM,N/A,True,NA,Rotten Tomatoes,95%
Boys Don't Cry,1999,R,2000-03-31,118 min,"Biography, Crime, Drama, Romance",Kimberly Peirce,"Kimberly Peirce, Andy Bienen","Hilary Swank, Chloë Sevigny, Peter Sarsgaard, Brendan Sexton III",Female-born Teena Brandon adopts his male identity of Brandon Teena and attempts to find himself and love in Nebraska.,English,USA,Won 1 Oscar. Another 47 wins & 37 nominations.,https://m.media-amazon.com/images/M/MV5BN2YyODgyYjMtN2ZiZC00OWMzLTg1NjgtZGIwN2NlYTYxMTkwXkEyXkFqcGdeQXVyMTAwMzUyOTc@._V1_SX300.jpg,86,7.6,86020,tt0171804,movie,N/A,NA,NA,NA,NA,N/A,NA,NA,NA,http://www.rottentomatoes.com/m/boys_dont_cry/,2000-04-18,N/A,Twentieth Century Fox,http://www.foxsearchlight.com/production/boysdontcry_synopsis.html,True,NA,Rotten Tomatoes,88%
Silent House,2011,R,2012-03-09,86 min,"Drama, Horror, Mystery, Thriller","Chris Kentis, Laura Lau","Gustavo Hernández (film ""La casa muda""), Laura Lau (screenplay), Oscar Estévez (original screen play)","Elizabeth Olsen, Adam Trese, Eric Sheffer Stevens, Julia Chan",A girl is trapped inside her family's lakeside retreat and becomes unable to contact the outside world as supernatural forces haunt the house with mysterious energy and consequences.,English,"France, USA",1 win & 2 nominations.,https://m.media-amazon.com/images/M/MV5BMTUzOTc2NjQ3MV5BMl5BanBnXkFtZTcwNzk3ODUzNw@@._V1_SX300.jpg,49,5.3,20630,tt1767382,movie,N/A,NA,NA,NA,NA,N/A,NA,NA,NA,http://www.rottentomatoes.com/m/silent_house_2012/,2012-07-24,"$9,921,042",Open Road Films,http://whyisthishappeningtome.net/,True,NA,Rotten Tomatoes,42%
The Lives of Others,2006,R,2007-03-30,137 min,"Drama, Thriller",Florian Henckel von Donnersmarck,Florian Henckel von Donnersmarck,"Martina Gedeck, Ulrich Mühe, Sebastian Koch, Ulrich Tukur","In 1984 East Berlin, an agent of the secret police, conducting surveillance on a writer and his lover, finds himself becoming increasingly absorbed by their lives.",German,Germany,Won 1 Oscar. Another 75 wins & 34 nominations.,https://m.media-amazon.com/images/M/MV5BNDUzNjYwNDYyNl5BMl5BanBnXkFtZTcwNjU3ODQ0MQ@@._V1_SX300.jpg,89,8.4,316496,tt0405094,movie,N/A,NA,NA,NA,NA,N/A,NA,NA,NA,http://www.rottentomatoes.com/m/the_lives_of_others/,2007-08-21,"$11,200,000",Sony Pictures Classics,http://www.thelivesofothers.com/,True,NA,Rotten Tomatoes,92%
Courageous,2011,PG-13,2011-09-30,129 min,Drama,Alex Kendrick,"Alex Kendrick, Stephen Kendrick","Ken Bevel, Alex Kendrick, Kevin Downes, Renee Jewell","When a tragedy strikes close to home, four police officers struggle with their faith and their roles as husbands and fathers; together they make a decision that will change all of their lives.",English,USA,2 wins & 2 nominations.,https://m.media-amazon.com/images/M/MV5BMjEyODMxNjM4OF5BMl5BanBnXkFtZTcwMTg5OTg3NQ@@._V1_SX300.jpg,42,7.1,17327,tt1630036,movie,N/A,NA,NA,NA,NA,N/A,NA,NA,NA,http://www.rottentomatoes.com/m/courageous/,2012-01-16,"$34,522,221",Sony Pictures,http://www.courageousthemovie.com/,True,NA,Rotten Tomatoes,33%
The Hustler,1961,Not Rated,1961-10-01,134 min,"Drama, Sport",Robert Rossen,"Sidney Carroll (screenplay), Robert Rossen (screenplay), Walter Tevis (based on the novel by)","Paul Newman, Jackie Gleason, Piper Laurie, George C. Scott",An up-and-coming pool player plays a long-time champion in a single high-stakes match.,English,USA,Won 2 Oscars. Another 11 wins & 20 nominations.,https://m.media-amazon.com/images/M/MV5BNjhjODI2NTItMGE1ZS00NThiLWE1MmYtOWE3YzcyNzY1MTJlXkEyXkFqcGdeQXVyNTc1NTQxODI@._V1_SX300.jpg,N/A,8,69769,tt0054997,movie,N/A,NA,NA,NA,NA,N/A,NA,NA,NA,http://www.rottentomatoes.com/m/hustler/,2002-06-04,N/A,Fox,N/A,True,NA,Rotten Tomatoes,98%
Smoke Signals,1998,PG-13,1998-11-27,89 min,"Comedy, Drama",Chris Eyre,"Sherman Alexie (book), Sherman Alexie (screenplay)","Adam Beach, Evan Adams, Irene Bedard, Gary Farmer","Young Indian man Thomas is a nerd in his reservation, wearing oversize glasses and telling everyone stories no-one wants to hear. His parents died in a fire in 1976, and Thomas was saved by...",English,"Canada, USA",11 wins & 8 nominations.,https://m.media-amazon.com/images/M/MV5BMjA4MjU1NTg0NF5BMl5BanBnXkFtZTgwODYwMDQ1MjE@._V1_SX300.jpg,76,7.2,9008,tt0120321,movie,N/A,NA,NA,NA,NA,N/A,NA,NA,NA,http://www.rottentomatoes.com/m/smoke_signals/,1999-07-27,N/A,Miramax Films,N/A,True,NA,Rotten Tomatoes,83%
American Splendor,2003,R,2003-09-12,101 min,"Biography, Comedy, Drama","Shari Springer Berman, Robert Pulcini","Harvey Pekar (comic book series American Splendor), Joyce Brabner (comic book series Our Cancer Year), Shari Springer Berman, Robert Pulcini","Chris Ambrose, Joey Krajcar, Josh Hutcherson, Cameron Carter",An original mix of fiction and reality illuminates the life of comic book hero everyman Harvey Pekar.,English,USA,Nominated for 1 Oscar. Another 31 wins & 49 nominations.,https://m.media-amazon.com/images/M/MV5BMjA0MjYxNjY1MV5BMl5BanBnXkFtZTcwNDkwMjAwMQ@@._V1_SX300.jpg,90,7.5,45184,tt0305206,movie,N/A,NA,NA,NA,NA,N/A,NA,NA,NA,http://www.rottentomatoes.com/m/american_splendor/,2004-02-03,"$5,977,550",Fine Line Features,http://www.americansplendormovie.com/main.html,True,NA,Rotten Tomatoes,94%
Before Sunset,2004,R,2004-07-30,80 min,"Drama, Romance",Richard Linklater,"Richard Linklater (screenplay), Julie Delpy (screenplay), Ethan Hawke (screenplay), Richard Linklater (story), Kim Krizan (story), Richard Linklater (characters), Kim Krizan (characters)","Ethan Hawke, Julie Delpy, Vernon Dobtcheff, Louise Lemoine Torrès","Nine years after Jesse and Celine first met, they encounter each other again on the French leg of Jesse's book tour.","English, French",USA,Nominated for 1 Oscar. Another 9 wins & 30 nominations.,https://m.media-amazon.com/images/M/MV5BMTQ1MjAwNTM5Ml5BMl5BanBnXkFtZTYwNDM0MTc3._V1_SX300.jpg,90,8.1,203549,tt0381681,movie,N/A,NA,NA,NA,NA,N/A,NA,NA,NA,http://www.rottentomatoes.com/m/before_sunset/,2004-11-09,"$5,600,000",Warner Independent Pictures,https://www.warnerbros.com/sunset,True,NA,Rotten Tomatoes,95%
Amores Perros,2000,R,2001-04-13,154 min,"Drama, Thriller",Alejandro G. Iñárritu,Guillermo Arriaga,"Emilio Echevarría, Gael García Bernal, Goya Toledo, Álvaro Guerrero","A horrific car accident connects three stories, each involving characters dealing with loss, regret, and life's harsh realities, all in the name of love.",Spanish,Mexico,Nominated for 1 Oscar. Another 54 wins & 22 nominations.,https://m.media-amazon.com/images/M/MV5BMWJhOTg5MWQtYTJjMi00YmFkLTg4ODgtYmU2YWVhODQ4ZDM3XkEyXkFqcGdeQXVyMTAwMzUyOTc@._V1_SX300.jpg,83,8.1,204257,tt0245712,movie,N/A,NA,NA,NA,NA,N/A,NA,NA,NA,http://www.rottentomatoes.com/m/amores_perros/,2001-09-25,"$4,856,342",Lionsgate,N/A,True,NA,Rotten Tomatoes,92%
